{"computed":{"metadata_entry_count":1,"metadata_sha256_summary_sha256":"3541e5eed9ad88701d29bb0102ff20e899e8808a1f47258c00e68555965e1886","provenance_entry_count":1,"provenance_entry_sha256_summary_sha256":"aab3b60cd51bc63cbc42ffb3a3adcde22ea486fb073da779c5114ce4d87fb2ec","provenance_leaf_count":1,"provenance_merkle_root":"210a17212d59d4ac02fae686e2906a8f4fa46bbbc5c250d064441ebf19ae7973"},"inputs":{"capture_metadata":{"file_sha256":"733705d394633c9b9cfabaab948c8f73434e04579337cb2ebdb239dd5cb66e97","metadata_contract_version":"tp.meta.capture.v1"},"metadata_manifest":{"file_sha256":"be42100ba3cea758e37277f5014b84ccd819365c19be5d8b2cfd86eab1e90be7","metadata_contract_version":"tp.meta.capture.v1","metadata_manifest_contract_version":"tp.meta.capture_manifest.v1"},"provenance_manifest":{"file_sha256":"3c6bb3fa38c2ced40867e8c37d736f223eabc2ecd0b53be78a0a80325a438952","metadata_contract_version":"tp.meta.capture.v1","provenance_contract_version":"tp.meta.provenance.v1"},"provenance_merkle":{"file_sha256":"e1cdec4e905160d5f924fb2a8b05d8b28be3f0139276b3ff6013def0b13cd3f2","provenance_contract_version":"tp.meta.provenance.v1","provenance_merkle_contract_version":"tp.meta.provenance_merkle.v1"}},"verification_contract_version":"tp.meta.verification_report.v1","verification_status":{"failure_code_label":null,"failure_message":null,"passed":true},"verifier":{"build_id":"phase4f-build-v1","name":"verify_phase4_chain.py","version":"phase4f-v1"}}
